IP地址,端口,TLS,数据中心,国家,地区,城市,ASN,ORG,延迟(ms),速度(MB/s)
183.94.30.165,45296,True,LAXchat,US,North America,Los Angeles,4837,CHINA UNICOM China169 Backbone,31,8.88
163.177.58.167,28381,True,NRTchat,JP,Asia Pacific,Tokyo,17623,China Unicom Shenzen network,60,8.88
183.236.51.57,30606,True,SINchat,SG,Asia Pacific,Singapore,9808,China Mobile Communications Group Co Ltd,12,8.88
183.236.51.57,31617,True,SINchat,SG,Asia Pacific,Singapore,9808,China Mobile Communications Group Co Ltd,16,8.88
45.251.10.227,30845,True,SINchat,SG,Asia Pacific,Singapore,133775,Xiamen,25,8.88
45.251.10.227,41628,True,SINchat,SG,Asia Pacific,Singapore,133775,Xiamen,32,8.88
113.31.109.111,443,True,SINchat,SG,Asia Pacific,Singapore,4811,China Telecom Group,100,8.88
163.177.58.167,30081,True,SEAchat,US,North America,Seattle,17623,China Unicom Shenzen network,88,8.88
