IP地址,端口,TLS,数据中心,国家,地区,城市,ASN,ORG,延迟(ms),速度(MB/s)
183.94.30.165,34057,True,MNLchat,PH,Asia Pacific,Manila,4837,CHINA UNICOM China169 Backbone,47,8.88
183.236.51.57,30606,True,BKKchat,TH,Asia Pacific,Bangkok,9808,China Mobile Communications Group Co Ltd,49,8.88
163.177.58.167,28381,True,NRTchat,JP,Asia Pacific,Tokyo,17623,China Unicom Shenzen network,43,8.88
113.31.109.111,443,True,SINchat,SG,Asia Pacific,Singapore,4811,China Telecom Group,112,8.88
163.177.58.167,30081,True,SEAchat,US,North America,Seattle,17623,China Unicom Shenzen network,27,8.88
